{
  "$schema": "https://json-schema.org/draft/2020-12/schema",
  "title": "Instrktr Course",
  "type": "object",
  "required": [
    "id",
    "title",
    "version",
    "engineVersion",
    "steps"
  ],
  "properties": {
    "id": {
      "type": "string",
      "pattern": "^[a-z0-9][a-z0-9-]*$"
    },
    "title": {
      "type": "string",
      "minLength": 1
    },
    "version": {
      "type": "string",
      "pattern": "^\\\\d+\\\\.\\\\d+\\\\.\\\\d+"
    },
    "engineVersion": {
      "type": "string"
    },
    "description": {
      "type": "string"
    },
    "steps": {
      "type": "array",
      "items": {
        "type": "object",
        "required": [
          "id",
          "title",
          "instructions",
          "hints"
        ],
        "properties": {
          "id": {
            "type": "string"
          },
          "title": {
            "type": "string"
          },
          "instructions": {
            "type": "string"
          },
          "hints": {
            "type": "array",
            "items": {
              "type": "string"
            }
          },
          "validator": {
            "type": "string"
          },
          "starter": {
            "type": "string"
          },
          "solution": {
            "type": "string"
          }
        }
      }
    }
  }
}
